{
  "$schema": "../../plugin-manifest-schema.json",
  "id": "example.gradle-wrapper",
  "name": "Gradle Wrapper Plugin",
  "version": "1.0.0",
  "description": "Example plugin demonstrating Gradle wrapper skills for Claude Code. This plugin provides basic Gradle project initialization and build capabilities.",
  "author": {
    "name": "Claude Code Community",
    "url": "https://github.com/jonnybbb/claude-gradle-skills"
  },
  "repository": "https://github.com/jonnybbb/claude-gradle-skills/tree/main/plugins/example-gradle-plugin",
  "homepage": "https://github.com/jonnybbb/claude-gradle-skills",
  "keywords": [
    "gradle",
    "wrapper",
    "build",
    "java",
    "kotlin",
    "build-automation"
  ],
  "license": "MIT",
  "category": "build-tools",
  "gradle": {
    "minVersion": "7.0"
  },
  "skills": [
    {
      "name": "gradle-init",
      "description": "Initialize a new Gradle project with specified project type and build script DSL",
      "examples": [
        "Initialize a Java application with Groovy DSL",
        "Create a Kotlin library with Kotlin DSL",
        "Set up a basic Java library project"
      ]
    },
    {
      "name": "gradle-build",
      "description": "Build, test, and package Gradle projects",
      "examples": [
        "Run ./gradlew build to compile and test",
        "Execute ./gradlew clean build for a fresh build",
        "Create distribution packages with ./gradlew assembleDist"
      ]
    },
    {
      "name": "gradle-dependencies",
      "description": "Manage project dependencies and view dependency tree",
      "examples": [
        "View dependency tree with ./gradlew dependencies",
        "Add a new dependency to build.gradle",
        "Update dependency versions"
      ]
    },
    {
      "name": "gradle-tasks",
      "description": "List and execute Gradle tasks",
      "examples": [
        "List all available tasks with ./gradlew tasks",
        "Run specific task with ./gradlew <taskName>",
        "Execute multiple tasks in sequence"
      ]
    }
  ],
  "dependencies": []
}
